{
  "github_username": "ChandraprakashAnandakumar",
  "subdomain": "chandra-test-03",
  "target": {
    "type": "CNAME",
    "value": "example.com"
  },
  "project": {
    "name": "Third End-to-End Test",
    "description": "Temporary request used to verify the complete dev-cv.in workflow."
  },
  "terms": "Y"
}
